"","id","title","complain","resp","status","dateCom","dateConc","typeOfDisp","procRules","subj","invInstrument","dateOfAccess","yearCom","yearConc","typeOfComplain","typeOfResp","complain_cowc","resp_cowc","awardOrDecision","notOfSubmission","writtenSubmission","procOrder","audioVisual","pressRelease","transcript","dateOfAccess2"
"43","109","District Municipality of La Punta (Peru) v. United Nations Office for Project Services (UNOPS)","District Municipality of La Punta  ","United Nations Office for Project Services  ","Concluded",NA,NA,"Contract-based or other arbitration","UNCITRAL Arbitration Rules 1976","- Other -",NA,2017-10-14,NA,NA,"State","IO",NA,NA,0,0,0,0,0,0,0,2017-10-14
"44","110","Sterling Merchant Finance Ltd v. Government of the Republic of Cabo Verde","Sterling Merchant Finance Ltd ","Government of the Republic of Cabo Verde ","Concluded",2014-07-11,2015-11-27,"Contract-based or other arbitration","UNCITRAL Arbitration Rules 2010","Water supply; sewerage, waste management and remediation","Contract Contract between Sterling Merchant Finance Ltd and The Growth and Competitiveness Project of the Government of the Republic of Cabo Verde dated 30 October 2006",2017-10-14,2014,2015,"Private Entity","State",NA,"CAP",0,0,0,0,0,0,0,2017-10-14
"45","82","Consorcio John W. Mcdougall Company Inc. y Dredge & Marine Corporation (U.S.A.) v. El Instituto Costarricense de Electricidad (Costa Rica)","Consorcio John W. Mcdougall Company Inc. y Dredge & Marine Corporation  ","El Instituto Costarricense de Electricidad  ","Concluded",NA,NA,"Contract-based or other arbitration","UNCITRAL Arbitration Rules 2010",NA,"Contract Contract No. 2010000029, entered between the Parties to the arbitration in 2010, awarded by Public Bidding Process No. 2009LI-000024-PROV",2017-10-14,NA,NA,"Private Entity","State",NA,NA,0,0,0,0,0,0,0,2017-10-14
"46","43","Mattioli Joint Venture v. The Ministry of Water and Energy representing the Federal Democratic Republic of Ethiopia","Mattioli Joint Venture ","The Ministry of Water and Energy representing the Federal Democratic Republic of Ethiopia ","Concluded",NA,NA,"Contract-based or other arbitration","- Other -",NA,NA,2017-10-14,NA,NA,"Private Entity","Other",NA,"ETH",0,0,0,0,0,0,0,2017-10-14
"47","40","Consta Joint Venture v. Chemin de Fer Djibouto-Ethiopien (the Ethiopian-Djibouti Railway), representing the Federal Democratic Republic of Ethiopia and the Republic of Djibouti","Consta Joint Venture ","Chemin de Fer Djibouto-Ethiopien , representing the Federal Democratic Republic of Ethiopia and the Republic of Djibouti ","Concluded",NA,NA,"Contract-based or other arbitration","- Other -",NA,NA,2017-10-14,NA,NA,"Private Entity","Other",NA,NA,0,0,0,0,0,0,0,2017-10-14
"48","25","The Atlanto-Scandian Herring Arbitration (The Kingdom of Denmark in respect of the Faroe Islands v. The European Union)","The Kingdom of Denmark in respect of the Faroe Islands ","The European Union ","Concluded",2013-08-16,2014-09-23,"Inter-state arbitration","- Other -","Agriculture, forestry and fishing","Multilateral treaty Treaty: UNCLOS",2017-10-14,2013,2014,"Other","Other",NA,NA,1,0,0,1,0,1,0,2017-10-14
"49","36","Windstream Energy LLC (U.S.A.) v. The Government of Canada","Windstream Energy LLC ","The Government of Canada ","Concluded",2013-01-28,2016-09-30,"Investment arbitration","UNCITRAL Arbitration Rules 2010","Electricity/Power","Multilateral treaty Treaty: NAFTA",2017-10-14,2013,2016,"Private Entity","State",NA,"CAN",1,1,1,1,1,1,1,2017-10-14
"50","7","The South China Sea Arbitration (The Republic of Philippines v. The People's Republic of China)","The Republic of Philippines ","The People’s Republic of China ","Concluded",2013-01-22,2016-07-12,"Inter-state arbitration","- Other -","Law of the sea","Multilateral treaty Treaty: UNCLOS",2017-10-14,2013,2016,"State","State","PHI","CHN",1,0,1,1,0,1,1,2017-10-14
"51","37","Arbitration under the Timor Sea Treaty (Timor-Leste v. Australia)","Timor-Leste ","Australia ","Concluded",2013-04-23,NA,"Inter-state arbitration","- Other -",NA,"Bilateral treaty Timor Sea Treaty Country A: Timor-Leste Country B: Australia",2017-10-14,2013,NA,"State","State","ETM","AUL",0,0,0,1,0,0,0,2017-10-14
"52","33","Review Panel established under the Convention on the Conservation and Management of High Seas Fishery Resources in the South Pacific Ocean","Not Available","Not Available","Concluded",2013-04-19,2013-07-05,"Other proceedings","Ad Hoc Rules of Procedure","Agriculture, forestry and fishing","Multilateral treaty Treaty: OTHER Article 17 and Annex II of the Convention on the Conservation and Management of High Seas Fishery Resources in the South Pacific Ocean",2017-10-14,2013,2013,NA,NA,NA,NA,0,0,1,1,1,0,1,2017-10-14
"53","65","The ARA Libertad Arbitration (Argentina v. Ghana)","The Argentine Republic ","The Republic of Ghana ","Concluded",2012-10-29,2013-11-11,"Inter-state arbitration","- Other -","Law of the sea",NA,2017-10-14,2012,2013,"State","State","ARG","GHA",1,1,0,1,1,1,0,2017-10-14
"54","2","U.S. Steel Global Holdings I B.V. (The Netherlands) v. The Slovak Republic","U.S. Steel Global Holdings I B.V.  ","The Slovak Republic ","Concluded",NA,NA,"Investment arbitration","UNCITRAL Arbitration Rules 1976","- Other -","Multilateral treaty Treaty: OTHER Agreement on Encouragement and Reciprocal Protection of Investments between the Kingdom of the Netherlands and the Czech and Slovak Federal Republic",2017-10-14,NA,NA,"Private Entity","State",NA,"SLO",0,0,0,0,0,0,0,2017-10-14
"55","98","St Marys VCNA, LLC v. Government of Canada","St Marys VCNA, LLC ","Government of Canada ","Concluded",2011-09-14,2013-03-29,"Investment arbitration","UNCITRAL Arbitration Rules 1976","Mining and quarrying","Multilateral treaty Treaty: NAFTA",2017-10-14,2011,2013,"Private Entity","State",NA,"CAN",1,1,0,1,0,0,0,2017-10-14
"56","55","Detroit International Bridge Company v. Government of Canada","Detroit International Bridge Company ","Government of Canada ","Concluded",2011-04-29,2015-08-17,"Investment arbitration","UNCITRAL Arbitration Rules 2010",NA,"Multilateral treaty Treaty: NAFTA",2017-10-14,2011,2015,"Private Entity","State",NA,"CAN",1,1,1,1,0,0,0,2017-10-14
"57","97","Ilya Levitis (United States) v. The Kyrgyz Republic","Ilya Levitis  ","The Kyrgyz Republic ","Concluded",NA,NA,"Investment arbitration","UNCITRAL Arbitration Rules 1976",NA,"Bilateral treaty Encouragement and Reciprocal Protection of Investment, signed on January 19, 1993 Country A: United States Country B: Kyrgyzstan Other Law of the Kyrgyz Republic on Investments in the Kyrgyz Republic",2017-10-14,NA,NA,"Private Entity","State",NA,"KYR",0,0,0,0,0,0,0,2017-10-14
"58","51","Mesa Power Group LLC (USA) v. Government of Canada","Mesa Power Group LLC  ","Government of Canada ","Concluded",NA,2016-03-24,"Investment arbitration","UNCITRAL Arbitration Rules 1976",NA,"Multilateral treaty Treaty: NAFTA",2017-10-14,NA,2016,"Private Entity","State",NA,"CAN",1,1,1,1,1,0,1,2017-10-14
"59","39","Murphy Exploration & Production Company - International v. The Republic of Ecuador","Murphy Exploration & Production Company - International ","The Republic of Ecuador ","Concluded",NA,2017-02-10,"Investment arbitration","UNCITRAL Arbitration Rules 1976",NA,"Bilateral treaty Treaty between the United States of America and the Republic of Ecuador Concerning the Encouragement and Reciprocal Protection of Investment signed 27 August 1993 Country A: United States Country B: Ecuador",2017-10-14,NA,2017,"Private Entity","State",NA,"ECU",1,0,0,1,0,0,0,2017-10-14
"60","5","Philip Morris Asia Limited (Hong Kong) v. The Commonwealth of Australia","Philip Morris Asia Limited  ","The Commonwealth of Australia ","Concluded",2011-06-22,NA,"Investment arbitration","UNCITRAL Arbitration Rules 2010","Manufacturing","Bilateral treaty Agreement between the Government of Hong Kong and the Government of Australia for the Promotion and Protection of Investments. Country A: China Country B: Australia",2017-10-14,2011,NA,"Private Entity","State",NA,"AUL",1,0,0,1,0,1,0,2017-10-14
"61","112","Peter A. Allard (Canada) v. The Government of Barbados","Peter A. Allard ","The Government of Barbados","Concluded",2010-05-21,2016-06-27,"Investment arbitration","UNCITRAL Arbitration Rules 1976","Environmental disputes","Bilateral treaty Agreement between the Government of Canada and the Government of Barbados for the Reciprocal Promotion and Protection of Investments Country A: Barbados Country B: Canada",2017-10-14,2010,2016,NA,"State",NA,"BAR",1,0,0,0,0,0,0,2017-10-14
"62","83","The Republic of Ecuador v. The United States of America","The Republic of Ecuador ","The United States of America ","Concluded",2011-06-28,NA,"Inter-state arbitration","UNCITRAL Arbitration Rules 1976","International investment law","Bilateral treaty Treaty between the United States of America and the Republic of Ecuador Concerning the Encouragement and Reciprocal Protection of Investment Country A: United States Country B: Ecuador",2017-10-14,2011,NA,"State","State","ECU","USA",0,1,1,0,0,0,0,2017-10-14
"63","3","Arbitration Between the Republic of Croatia and the Republic of Slovenia","Republic of Croatia","Republic of Slovenia","Concluded",NA,2017-06-29,"Inter-state arbitration","Permanent Court of Arbitration Optional Rules for Arbitrating Disputes between Two States","Border delimitation","Bilateral treaty Arbitration Agreement Country A: Croatia Country B: Slovenia",2017-10-14,NA,2017,"State","State","CRO","SLV",1,0,0,0,1,1,0,2017-10-14
"64","140","Copper Mesa Mining Corporation (Canada) v. The Republic of Ecuador","Copper Mesa Mining Corporation ","The Republic of Ecuador ","Concluded",2011-01-20,2016-03-15,"Investment arbitration","UNCITRAL Arbitration Rules 1976","Mining and quarrying","Bilateral treaty Agreement between the Government of Canada and the Government of the Republic of Ecuador for the Promotion and Reciprocal Protection of Investments, signed 29 April 1996. Country A: Canada Country B: Ecuador",2017-10-14,2011,2016,"Private Entity","State",NA,"ECU",1,0,0,0,0,0,0,2017-10-14
"65","56","Railway Land Arbitration (Malaysia/Singapore)","Malaysia","Republic of Singapore","Concluded",NA,NA,"Inter-state arbitration","- Other -",NA,NA,2017-10-14,NA,NA,"State","State","MAL","SIN",0,0,0,0,0,0,0,2017-10-14
"66","72","1. Guaracachi America, Inc. (U.S.A.) & 2. Rurelec plc (United Kingdom) v. Plurinational State of Bolivia","Guaracachi America, Inc.  	                    	                        Rurelec plc  ","Plurinational State of Bolivia ","Concluded",2010-11-24,2014-01-31,"Investment arbitration","UNCITRAL Arbitration Rules 2010","Electricity/Power","Bilateral treaty Treaty between the Government of the United States of America and the Government of the Republic of Bolivia Concerning the Encouragement and Reciprocal Protection of Investment Country A: United States Country B: Bolivia Bilateral treaty Agreement between the Government of the United Kingdom of Great Britain and Northern Ireland and the Government of the Republic of Bolivia for the Promotion and Protection of Investments Country A: United Kingdom Country B: Bolivia",2017-10-14,2010,2014,"Private Entity","State",NA,"BOL",1,1,1,1,1,0,1,2017-10-14
"67","47","OAO Gazprom v. The Republic of Lithuania","OAO Gazprom ","The Republic of Lithuania ","Concluded",NA,NA,"Investment arbitration","UNCITRAL Arbitration Rules 1976",NA,"Bilateral treaty Agreement Between the Government of the Russian Federation and the Government of the Republic of Lithuania on the Promotion and Reciprocal Protection of Investments Country A: Russian Federation Country B: Lithuania",2017-10-14,NA,NA,"Other","State",NA,"LIT",0,0,0,0,0,0,0,2017-10-14
"68","11","Chagos Marine Protected Area Arbitration (Mauritius v. United Kingdom)","The Republic of Mauritius ","The United Kingdom of Great Britain and Northern Ireland ","Concluded",2010-12-20,2015-03-18,"Inter-state arbitration","- Other -","- Other -","Multilateral treaty Treaty: UNCLOS",2017-10-14,2010,2015,"State","State","MAS","UKG",1,1,1,1,0,1,1,2017-10-14
"69","20","Indus Waters Kishenganga Arbitration (Pakistan v. India)","Pakistan ","India ","Concluded",2010-05-17,2013-12-20,"Inter-state arbitration","- Other -","Water supply; sewerage, waste management and remediation","Bilateral treaty Indus Waters Treaty (1960) Country A: Pakistan Country B: India",2017-10-14,2010,2013,"State","State","PAK","IND",1,0,0,0,0,1,0,2017-10-14
"70","22","Dunkeld International Investment Limited (Turks & Caicos)  v. The Government of Belize","Dunkeld International Investment Limited  ","The Government of Belize ","Concluded",2010-07-26,NA,"Investment arbitration","UNCITRAL Arbitration Rules 1976",NA,"Bilateral treaty Agreement between the Government of the United Kingdom of Great Britain and Northern Ireland and the Government of Belize for the Promotion and Protection of Investments Country A: United Kingdom Country B: Belize",2017-10-14,2010,NA,"Private Entity","State",NA,"BLZ",1,0,0,1,0,0,0,2017-10-14
"71","48","1. China Heilongjiang International Economic & Technical Cooperative Corp., 2. Beijing Shougang Mining Investment Company Ltd., and 3. Qinhuangdaoshi Qinlong International Industrial Co. Ltd. v. Mongolia","China Heilongjiang International Economic & Technical Cooperative Corp. 	                    	                        Beijing Shougang Mining Investment Company Ltd. 	                    	                        Qinhuangdaoshi Qinlong International Industrial Co. Ltd. ","Mongolia ","Concluded",NA,2017-06-30,"Investment arbitration","- Other -",NA,"Bilateral treaty Agreement between the Government of the Mongolian People’s Republic and the Government of the People’s Republic of China concerning the Encouragement and Reciprocal Protection of Investments dated 26 August 1991 Country A: Mongolia Country B: China",2017-10-14,NA,2017,"Private Entity","State",NA,"MON",0,0,0,0,0,0,0,2017-10-14
"72","44","British Caribbean Bank Ltd. (Turks & Caicos) v. The Government of Belize","British Caribbean Bank Ltd.  ","The Government of Belize ","Concluded",NA,NA,"Investment arbitration","UNCITRAL Arbitration Rules 1976",NA,"Bilateral treaty Agreement between the Government of the United Kingdom of Great Britain and Northern Ireland and the Government of Belize for the Promotion and Protection of Investments Country A: United Kingdom Country B: Belize",2017-10-14,NA,NA,"Private Entity","State",NA,"BLZ",1,0,0,1,0,0,0,2017-10-14
"73","38","European American Investment Bank AG v. The Slovak Republic","European American Investment Bank AG ","The Slovak Republic ","Concluded",NA,NA,"Investment arbitration","UNCITRAL Arbitration Rules 1976","Financial and insurance","Bilateral treaty Agreement between the Republic of Austria and the Czech and Slovak Federal Republic Concerning the Promotion and Protection of Investments Country A: Austria Country B: Slovakia",2017-10-14,NA,NA,"Private Entity","State",NA,"SLO",0,0,0,0,0,0,0,2017-10-14
"74","18","Bay of Bengal Maritime Boundary Arbitration between Bangladesh and India","People's Republic of Bangladesh ","Republic of India ","Concluded",2009-10-08,2014-07-07,"Inter-state arbitration","- Other -","Border delimitation","Multilateral treaty Treaty: UNCLOS",2017-10-14,2009,2014,"State","State","BNG","IND",1,0,1,1,0,1,1,2017-10-14
"75","23","Dunkeld International Investment Limited (Turks & Caicos)  v. The Government of Belize","Dunkeld International Investment Limited  ","The Government of Belize ","Concluded",2010-07-26,2016-06-28,"Investment arbitration","UNCITRAL Arbitration Rules 1976",NA,"Bilateral treaty Agreement between the Government of the United Kingdom of Great Britain and Northern Ireland and the Government of Belize for the Promotion and Protection of Investments Country A: United Kingdom Country B: Belize",2017-10-14,2010,2016,"Private Entity","State",NA,"BLZ",1,0,0,0,0,0,0,2017-10-14
"76","73","Polis Fondi Immobliare di Banche Popolare S.G.R.p.A v. International Fund for Agricultural Development (IFAD)","Polis Fondi Immobliare di Banche Popolare S.G.R.p.A ","International Fund for Agricultural Development  ","Concluded",2009-11-10,2010-12-17,"Contract-based or other arbitration","UNCITRAL Arbitration Rules 1976","Real estate",NA,2017-10-14,2009,2010,"Private Entity","IO",NA,NA,1,0,0,0,0,0,0,2017-10-14
"77","131","Melvin J. Howard, Centurion Health Corp. & Howard Family Trust v. The Government of Canada","Melvin J. Howard, Centurion Health Corp. & Howard Family Trust ","The Government of Canada ","Concluded",2008-07-11,2010-08-09,"Investment arbitration","UNCITRAL Arbitration Rules 1976","Human health and social work",NA,2017-10-14,2008,2010,"Private Entity","State",NA,"CAN",1,0,1,0,0,0,0,2017-10-14
"78","90","InterTrade Holding GmbH v. The Czech Republic","InterTrade Holding GmbH ","The Czech Republic ","Concluded",NA,2012-06-07,"Investment arbitration","UNCITRAL Arbitration Rules 1976",NA,NA,2017-10-14,NA,2012,"Private Entity","State",NA,"CZR",0,0,0,0,0,0,0,2017-10-14
"79","10","HICEE B.V. v. The Slovak Republic","HICEE B.V. ","The Slovak Republic ","Concluded",2008-12-17,2011-10-17,"Investment arbitration","UNCITRAL Arbitration Rules 1976","Financial and insurance","Bilateral treaty Agreement on Encouragement and Reciprocal Protection of Investments between The Kingdom of the Netherlands and The Czech and Slovak Federal Republic, signed on April 29, 1991, entered into force on October 1, 1992. Country A: Netherlands Country B: Slovakia",2017-10-14,2008,2011,"Other","Other",NA,"SLO",0,0,0,0,0,0,0,2017-10-14
"80","28","Achmea B.V. (formerly known as “Eureko B.V.”) v. The Slovak Republic","Achmea B.V.  ","The Slovak Republic ","Concluded",2008-10-01,2012-12-07,"Investment arbitration","UNCITRAL Arbitration Rules 1976","Financial and insurance","Bilateral treaty Agreement on Encouragement and Reciprocal Protection of Investments Between the Kingdom of the Netherlands and The Czech and Slovak Federal Republic Country A: Netherlands Country B: Slovakia",2017-10-14,2008,2012,"Private Entity","State",NA,"SLO",1,0,0,0,0,0,0,2017-10-14
"81","92","The Government of Sudan / The Sudan People's Liberation Movement/Army (Abyei Arbitration)","The Government of Sudan","The Sudan People's Liberation Movement/Army","Concluded",NA,NA,"Other proceedings","Permanent Court of Arbitration Optional Rules for Arbitrating Disputes between Two Parties of Which Only One Is a State","Land border delimitation","Other Arbitration Agreement between the Government of Sudan and The Sudan People's Liberation Movement/Army and Delimiting Abyei Area, 7 July 2008",2017-10-14,NA,NA,NA,NA,"SUD",NA,1,0,1,0,1,1,1,2017-10-14
"82","96","1. TCW Group, Inc. 2. Dominican Energy Holdings, L.P. v. The Dominican Republic","TCW Group, Inc. 	                    	                        Dominican Energy Holdings, L.P. ","Dominican Republic ","Concluded",2007-12-21,2009-07-16,"Investment arbitration","UNCITRAL Arbitration Rules 1976","Electricity/Power","Other Dominican Republic-Central America-United States Free Trade Agreement signed on August 5, 2004",2017-10-14,2007,2009,"Private Entity","State",NA,"DOM",1,1,1,1,0,0,0,2017-10-14
"83","84","Vito G. Gallo v. Government of Canada","Vito G. Gallo ","The Government of Canada ","Concluded",2007-03-30,2011-09-15,"Investment arbitration","UNCITRAL Arbitration Rules 1976","Water supply; sewerage, waste management and remediation","Multilateral treaty Treaty: NAFTA",2017-10-14,2007,2011,"Private Entity","State",NA,"CAN",1,1,1,1,0,0,0,2017-10-14
"84","66","Chemtura Corporation (formerly Crompton Corporation) v. Government of Canada","Chemtura Corporation  ","The Government of Canada ","Concluded",2008-01-21,2010-08-02,"Investment arbitration","UNCITRAL Arbitration Rules 1976","Agriculture, forestry and fishing","Multilateral treaty Treaty: NAFTA",2017-10-14,2008,2010,"Private Entity","State",NA,"CAN",1,0,0,0,0,0,0,2017-10-14
"85","30","Romak S.A. (Switzerland) v. The Republic of Uzbekistan","Romak S.A. ","The Republic of Uzbekistan ","Concluded",2006-03-20,2009-11-26,"Investment arbitration","UNCITRAL Arbitration Rules 1976","Agriculture, forestry and fishing","Bilateral treaty Agreement between the Swiss Confederation and the Republic of Uzbekistan on the Promotion and the Reciprocal Protection of Investments Country A: Switzerland Country B: Uzbekistan",2017-10-14,2006,2009,"Private Entity","State",NA,"UZB",1,0,0,0,0,0,0,2017-10-14
"86","85","1. Chevron Corporation and 2. Texaco Petroleum Company v. The Republic of Ecuador","Chevron Corporation 	                    	                        Texaco Petroleum Company ","The Republic of Ecuador ","Concluded",NA,NA,"Investment arbitration","UNCITRAL Arbitration Rules 1976","Oil and gas","Bilateral treaty Treaty between the United States of America and the Republic of Ecuador concerning the Encouragement and Reciprocal Protection of Investment Country A: United States Country B: Ecuador",2017-10-14,NA,NA,"Private Entity","State",NA,"ECU",0,0,0,0,0,0,0,2017-10-14
"87","95","1. Centerra Gold Inc. (Canada) and 2. Kumtor Gold Company (Kyrgyz Republic) v. The Kyrgyz Republic","Centerra Gold Inc. & Kumtor Gold Co. ","Kyrgyz Republic ","Concluded",NA,NA,"Investment arbitration","UNCITRAL Arbitration Rules 1976",NA,"Contract Investment Agreement of December 31, 2003 Other Law No. 66 ‘On Investments in the Kyrgyz Republic’ of March 27, 2003",2017-10-14,NA,NA,"Private Entity","State",NA,"KYR",0,0,0,1,0,0,0,2017-10-14
"88","62","Veteran Petroleum Limited (Cyprus) v. The Russian Federation","Veteran Petroleum Limited  ","The Russian Federation ","Concluded",NA,2014-07-18,"Investment arbitration","UNCITRAL Arbitration Rules 1976","International investment law","Multilateral treaty Treaty: Energy Charter Treaty (ECT)",2017-10-14,NA,2014,"Private Entity","State",NA,"RUS",1,0,0,0,0,0,0,2017-10-14
"89","61","Yukos Universal Limited (Isle of Man) v. The Russian Federation","Yukos Universal Limited  ","The Russian Federation ","Concluded",NA,2014-07-18,"Investment arbitration","UNCITRAL Arbitration Rules 1976","International investment law","Multilateral treaty Treaty: Energy Charter Treaty (ECT)",2017-10-14,NA,2014,"Private Entity","State",NA,"RUS",1,0,0,0,0,0,0,2017-10-14
"90","60","Hulley Enterprises Limited (Cyprus) v. The Russian Federation","Hulley Enterprises Limited  ","The Russian Federation ","Concluded",NA,2014-07-18,"Investment arbitration","UNCITRAL Arbitration Rules 1976","International investment law","Multilateral treaty Treaty: Energy Charter Treaty (ECT)",2017-10-14,NA,2014,"Private Entity","State",NA,"RUS",1,0,0,0,0,0,0,2017-10-14
"91","108","Land Reclamation by Singapore in and around the Straits of Johor (Malaysia v. Singapore)","Malaysia ","Singapore ","Concluded",2003-07-04,2005-09-01,"Inter-state arbitration","- Other -","Law of the sea","Multilateral treaty Treaty: UNCLOS",2017-10-14,2003,2005,"State","State","MAL","SIN",1,0,0,0,0,1,0,2017-10-14
"92","9","Guyana v. Suriname","Guyana ","Suriname ","Concluded",2004-02-24,2007-09-17,"Inter-state arbitration","Ad Hoc Rules of Procedure","Maritime boundary delimitation","Multilateral treaty Treaty: UNCLOS",2017-10-14,2004,2007,"State","State","GUY","SUR",1,0,1,1,0,0,1,2017-10-14
"93","104","Barbados v. Trinidad and Tobago","Barbados ","The Republic of Trinidad and Tobago ","Concluded",2004-02-16,2006-04-11,"Inter-state arbitration","- Other -","Maritime boundary delimitation","Multilateral treaty Treaty: UNCLOS",2017-10-14,2004,2006,"State","State","BAR","TRI",1,0,1,1,0,1,1,2017-10-14
"94","70","The Eurotunnel Arbitration","1. The Channel Tunnel Group Limited 	                    	                         2. France-Manche S.A. ","1. The Secretary of State for Transport of the Government of the United Kingdom of Great Britain and Northern Ireland  	                    	                        2. le ministre de l’équipement, des transports, de l’aménagement du territoire, du tourisme et de la mer du Gouvernement de la République française ","Concluded",2003-12-01,2007-01-30,"Investment arbitration","- Other -","Manufacturing","Bilateral treaty Treaty between the French Republic and the United Kingdom of Great Britain and Northern Ireland Concerning the Construction and Operation by Private Concessionaires of a Channel Fixed Link Country A: France Country B: United Kingdom",2017-10-14,2003,2007,"Private Entity","State",NA,"UKG",1,0,0,0,0,0,0,2017-10-14
"95","106","Telekom Malaysia Berhad/Government of Ghana","Telekom Malaysia Berhad  ","Government of Ghana ","Concluded",NA,NA,"Investment arbitration","UNCITRAL Arbitration Rules 1976",NA,NA,2017-10-14,NA,NA,"Private Entity","State",NA,"GHA",0,0,0,0,0,0,0,2017-10-14
"96","1","Iron Rhine Arbitration (Belgium/Netherlands)","The Kingdom of Belgium ","The Kingdom of the Netherlands ","Concluded",2003-07-23,2005-05-24,"Inter-state arbitration","Permanent Court of Arbitration Optional Rules for Arbitrating Disputes between Two States","Transportation and storage","Other Compromis concluded by exchange of diplomatic notes dated July 22 and 23, 2003.",2017-10-14,2003,2005,"State","State","BEL","NTH",1,1,1,0,0,1,0,2017-10-14
"97","100","MOX Plant Case (Ireland v. United Kingdom)","Ireland ","The United Kingdom of Great Britain and Northern Ireland ","Concluded",2001-10-25,2008-06-06,"Other proceedings","- Other -","Law of the sea","Multilateral treaty Treaty: UNCLOS",2017-10-14,2001,2008,"State","State","IRE","UKG",0,0,1,1,0,1,1,2017-10-14
