"","id","title","complain","resp","status","dateCom","dateConc","typeOfDisp","procRules","subj","invInstrument","dateOfAccess","yearCom","yearConc","typeOfComplain","typeOfResp","complain_cowc","resp_cowc","awardOrDecision","notOfSubmission","writtenSubmission","procOrder","audioVisual","pressRelease","transcript","dateOfAccess2"
"98","101","Saluka Investments B.V. v. Czech Republic","Saluka Investments B.V ","Czech Republic ","Concluded",NA,2006-03-17,"Other proceedings","UNCITRAL Arbitration Rules 1976",NA,"Bilateral treaty Agreement on Encouragement and Reciprocal Protection of Investments Between the Kingdom of The Netherlands and the Czech and Slovak Federal Republic, signed on 29 April 1991 Country A: Netherlands Country B: Czech Republic",2017-10-14,NA,2006,"Private Entity","State",NA,"CZR",1,0,0,0,0,1,0,2017-10-14
"99","34","Ireland v. United Kingdom (OSPAR Arbitration)","Ireland ","The United Kingdom of Great Britain and Northern Ireland ","Concluded",2001-06-15,2003-07-02,"Inter-state arbitration","Ad Hoc Rules of Procedure","Treaty interpretation",NA,2017-10-14,2001,2003,"State","State","IRE","UKG",1,0,1,0,0,0,1,2017-10-14
"100","71","Eritrea-Ethiopia Claims Commission","State of Eritrea ","Federal Democratic Republic of Ethiopia ","Concluded",2000-12-12,2009-08-17,"Other proceedings","- Other -","Claims commission","Bilateral treaty Agreement signed in Algiers on 12 December 2000 between the Governments of the State of Eritrea and the Federal Democratic Republic of Ethiopia Country A: Eritrea Country B: Ethiopia",2017-10-14,2000,2009,"State","State","ERI","ETH",1,0,0,0,0,1,0,2017-10-14
"101","99","Eritrea-Ethiopia Boundary Commission","State of Eritrea ","Federal Democratic Republic of Ethiopia ","Concluded",2000-12-12,2002-04-13,"Inter-state arbitration","Ad Hoc Rules of Procedure","Border delimitation",NA,2017-10-14,2000,2002,"State","State","ERI","ETH",1,0,0,1,0,1,0,2017-10-14
"102","91","Bank for International Settlements","Dr. Horst Reineccius  	                    	                        First Eagle SoGen Funds, Inc.  	                    	                        Mr. Pierre Mathieu and La Société de Concours Hippique de La Châtre     ","Bank for International Settlements ","Concluded",2001-03-07,2003-09-19,"Other proceedings","Ad Hoc Rules of Procedure","- Other -","Other Agreement Regarding the Complete and Final Settlement of Question of Reparations from Germany, January 20, 1930",2017-10-14,2001,2003,"Private Entity","Other",NA,NA,1,1,0,1,0,1,0,2017-10-14
"103","31","The Rhine Chlorides Arbitration concerning the Auditing of Accounts (The Netherlands/France)","The Netherlands ","France ","Concluded",1999-10-21,2004-03-12,"Inter-state arbitration","Ad Hoc Rules of Procedure","Treaty interpretation","Multilateral treaty Treaty: OTHER 1976 Convention on the Protection of the Rhine against Pollution by Chlorides",2017-10-14,1999,2004,"State","State","NTH","FRN",1,0,0,0,0,0,0,2017-10-14
"104","35","Larsen v. Hawaiian Kingdom","Lance Paul Larsen ","The Hawaiian Kingdom ","Concluded",1999-11-08,2001-02-05,"Other proceedings","UNCITRAL Arbitration Rules 1976","Treaty interpretation","Other The 1849 Treaty of Friendship, Commerce and Navigation with the United States of America",2017-10-14,1999,2001,"Private Entity","State",NA,NA,1,0,0,0,0,0,0,2017-10-14
"105","81","Eritrea/Yemen - Sovereignty and Maritime Delimitation in the Red Sea","Eritrea ","Yemen ","Concluded",NA,1999-12-17,"Inter-state arbitration","- Other -","Maritime boundary delimitation","Other Agreement to Arbitrate Dated 3 October 1996",2017-10-14,NA,1999,"State","State","ERI","YEM",1,0,0,0,0,0,0,2017-10-14
"106","16","Radio Corporation of America v. China","Radio Corporation of America ","The National Government of the Republic of China ","Concluded",NA,1935-04-13,"Contract-based or other arbitration","1907 Convention for the Pacific Settlement of International Disputes","Information and communication","Contract Traffic Agreement concluded between the Radio Corporation of America, a corporation organized under the laws of the State of Delaware, U.S.A., and the National Council of Reconstruction, representing the National Government of the Republic of China, on November 10th, 1928",2017-10-14,NA,1935,"Private Entity","State",NA,"TAW",1,0,0,0,0,0,0,2017-10-14
"107","94","Island of Palmas (or Miangas) (The Netherlands / The United States of America)","The United States of America ","The Netherlands ","Concluded",1925-01-23,1928-04-04,"Inter-state arbitration","1907 Convention for the Pacific Settlement of International Disputes","- Other -","Other A special agreement concluded on 23 January 1925 between the United States of America and the Netherlands relating to the arbitration of differences respecting sovereignty over the Island of Palmas (or Miangas).",2017-10-14,1925,1928,"State","State","USA","NTH",1,0,0,0,0,0,0,2017-10-14
"108","88","Norwegian Shipowners' Claims (Norway v. United States of America)","Norway ","United States of America ","Concluded",1921-06-30,1922-10-13,"Inter-state arbitration","Ad Hoc Rules of Procedure","Post-conflict situations","Other Arbitration Convention, April 4, 1908. Special Agreement, June 30, 1921.",2017-10-14,1921,1922,"State","State","NOR","USA",1,0,0,0,0,0,0,2017-10-14
"109","87","Boundaries in the Island of Timor (The Netherlands v. Portugal)","The Netherlands ","Portugal ","Concluded",1913-04-03,1914-06-25,"Inter-state arbitration","- Other -","Border delimitation","Other Compromis signed at The Hague, April 3, 1913",2017-10-14,1913,1914,"State","State","NTH","POR",1,0,0,0,0,0,0,2017-10-14
"110","102","The Carthage (France / Italy)","France ","Italy ","Concluded",1912-03-06,1913-05-06,"Inter-state arbitration","1907 Convention for the Pacific Settlement of International Disputes","- Other -",NA,2017-10-14,1912,1913,"State","State","FRN","ITA",0,0,0,0,0,0,0,2017-10-14
"111","68","French Postal Vessel ""Manouba""","France ","Italy ","Concluded",1912-03-06,1913-05-06,"Inter-state arbitration","- Other -","Law of the sea","Other Agreement dated January 26, 1912, and compromis dated March 6, 1912",2017-10-14,1912,1913,"State","State","FRN","ITA",1,0,0,0,0,0,0,2017-10-14
"112","79","Arrest and Return of Savarkar (France / Great Britain)","France ","Great Britain ","Concluded",1910-10-25,1911-02-24,"Inter-state arbitration","- Other -","- Other -","Other Agreement dated 25 October 1910",2017-10-14,1910,1911,"State","State","FRN","UKG",1,0,0,0,0,0,0,2017-10-14
"113","89","Russian Claim for Interest on Indemnities (Russia / Turkey)","Russia ","Turkey ","Concluded",NA,1912-11-11,"Inter-state arbitration","1907 Convention for the Pacific Settlement of International Disputes","Post-conflict situations","Other Arbitration Compromis signed at Constantinople between Russia and Turkey, July 22/August 4, 1910",2017-10-14,NA,1912,"State","State","RUS","TUR",1,0,0,0,0,0,0,2017-10-14
"114","80","Canevaro claim (Italy / Peru)","Italy ","Peru ","Concluded",1910-04-25,1912-05-03,"Inter-state arbitration","- Other -","Financial and insurance",NA,2017-10-14,1910,1912,"State","State","ITA","PER",1,0,0,0,0,0,0,2017-10-14
"115","78","The Orinoco Steamship Company case (United States of America / Venezuela)","United States of America ","Venezuela ","Concluded",1909-02-13,1910-10-25,"Inter-state arbitration","- Other -","- Other -","Bilateral treaty Agreement signed at Caracas on the 13th of February 1909 Country A: United States Country B: Venezuela",2017-10-14,1909,1910,"State","State","USA","VEN",1,0,0,0,0,0,0,2017-10-14
"116","74","The North Atlantic Coast Fisheries Case (Great Britain / United States of America)","Great Britain ","United States of America ","Concluded",1909-01-27,1910-09-07,"Inter-state arbitration","1907 Convention for the Pacific Settlement of International Disputes","Agriculture, forestry and fishing","Bilateral treaty Special Agreement between the United States of America and Great Britain signed at Washington on the 27th of January 27, 1909 Country A: United States Country B: United Kingdom",2017-10-14,1909,1910,"State","State","UKG","USA",1,0,0,0,0,0,0,2017-10-14
"117","67","Deserters of Casablanca (France/Germany)","France ","Germany ","Concluded",1908-11-24,1909-05-22,"Inter-state arbitration","1907 Convention for the Pacific Settlement of International Disputes","- Other -","Other Protocol of November 10, 1908, and Agreement to Arbitrate of November 24, 1908 between the Government of the French Republic and the Imperial German Government",2017-10-14,1908,1909,"State","State","FRN","GMY",1,0,0,0,0,0,0,2017-10-14
"118","77","The Grisbådarna Case","Norway ","Sweden ","Concluded",1908-03-14,1909-10-23,"Inter-state arbitration","- Other -","Maritime boundary delimitation","Bilateral treaty Convention of March 14, 1908 Country A: Norway Country B: Sweden",2017-10-14,1908,1909,"State","State","NOR","SWD",1,0,0,0,0,0,0,2017-10-14
"119","93","Muscat Dhows (France / Great Britain)","France ","Great Britain ","Concluded",1904-10-13,1905-08-08,"Inter-state arbitration","1899 Convention for the Pacific Settlement of International Disputes","- Other -","Other Compromis concluded in London on October 13, 1904 between the Great Britain and France",2017-10-14,1904,1905,"State","State","FRN","UKG",1,0,0,0,0,0,0,2017-10-14
"120","76","Preferential Treatment of Claims of Blockading Powers against Venezuela (Germany, Great Britain and Italy v. Venezuela)","Germany, Great Britain, Italy ","Venezuela ","Concluded",1902-05-07,1904-02-22,"Inter-state arbitration","1899 Convention for the Pacific Settlement of International Disputes","- Other -","Multilateral treaty Treaty: OTHER Protocols signed at Washington on May 7, 1903",2017-10-14,1902,1904,"State","State",NA,"VEN",1,0,0,0,0,0,0,2017-10-14
"121","69","Japanese House Tax (Germany, France, and Great Britain / Japan)","Germany , France , Great Britain ","Japan ","Concluded",1902-08-28,1905-05-22,"Inter-state arbitration","1899 Convention for the Pacific Settlement of International Disputes","Treaty interpretation","Other Protocols signed at Tokyo on August 28, 1902 by Japan on the one part and Germany, France and Great Britain on the other part.",2017-10-14,1902,1905,"State","State",NA,"JPN",1,0,0,0,0,0,0,2017-10-14
"122","75","The Pious Fund of the Californias (The United States of America v. The United Mexican States)","The United Mexican States ","The United States of America ","Concluded",1902-05-22,1902-10-14,"Inter-state arbitration","- Other -","Financial and insurance","Bilateral treaty Protocol of an Agreement between the United States and the Republic of Mexico for the Adjustment of certain contentions arising under what is known as The Pious Fund of the Californias, signed at Washington on May 22, 1902 Country A: United States Country B: Mexico",2017-10-14,1902,1902,"State","State","MEX","USA",1,0,0,0,0,0,0,2017-10-14
