"","id","title","complain","resp","status","dateCom","dateConc","typeOfDisp","procRules","subj","invInstrument","dateOfAccess","yearCom","yearConc","typeOfComplain","typeOfResp","complain_cowc","resp_cowc","awardOrDecision","notOfSubmission","writtenSubmission","procOrder","audioVisual","pressRelease","transcript","dateOfAccess2"
"1","149","Dispute Concerning Coastal State Rights in the Black Sea, Sea of Azov, and Kerch Strait (Ukraine v. the Russian Federation)","Ukraine ","The Russian Federation ","Pending",2016-09-16,NA,"Inter-state arbitration","- Other -",NA,"Multilateral treaty Treaty: UNCLOS",2017-10-14,2016,NA,"State","State","UKR","RUS",NA,0,0,1,0,1,0,2017-10-14
"2","117","The ""Enrica Lexie"" Incident (Italy v. India)","Italy","India","Pending",2015-06-26,NA,"Inter-state arbitration","Ad Hoc Rules of Procedure","Law of the sea","Multilateral treaty Treaty: UNCLOS",2017-10-14,2015,NA,"State","State","ITA","IND",NA,0,1,1,0,1,1,2017-10-14
"3","53","The Duzgit Integrity Arbitration (Malta v. São Tomé and Príncipe)","Malta ","São Tomé and Príncipe ","Pending",2013-10-22,NA,"Inter-state arbitration","Ad Hoc Rules of Procedure","Transportation and storage","Multilateral treaty Treaty: UNCLOS",2017-10-14,2013,NA,"State","State","MLT","STP",NA,0,0,0,0,1,0,2017-10-14
"4","21","The Arctic Sunrise Arbitration (Netherlands v. Russia)","The Netherlands ","The Russian Federation ","Pending",2013-10-04,NA,"Inter-state arbitration","- Other -","- Other -","Multilateral treaty Treaty: UNCLOS",2017-10-14,2013,NA,"State","State","NTH","RUS",NA,1,1,1,0,1,1,2017-10-14
"5","132","Conciliation between  The Democratic Republic of Timor-Leste and The Commonwealth of Australia","The Democratic Republic of Timor-Leste","The Commonwealth of Australia","Pending",2016-04-11,NA,"Inter-state conciliation","- Other -","Law of the sea","Other United Nations Convention on the Law of the Sea",2017-10-14,2016,NA,"State","State","ETM","AUL",NA,0,0,0,1,1,1,2017-10-14
"6","151","(i) NJSC Naftogaz of Ukraine (Ukraine) et al. v. The Russian Federation"," NJSC Naftogaz of Ukraine  	                    	                         PJSC State Joint Stock Company Chornomornaftogaz  	                    	                         PJSC Ukrtransgaz   	                    	                         Subsidiary Company Likvo  	                    	                         PJSC Ukrgasvydobuvannya  	                    	                         PJSC Ukrtransnafta  	                    	                         Subsidiary Company Gaz Ukraiiny  ","The Russian Federation ","Pending",2016-10-17,NA,"Investment arbitration","UNCITRAL Arbitration Rules 1976","Electricity/Power","Bilateral treaty Agreement between the Government of the Russian Federation and the Cabinet of Ministers of Ukraine on the Encouragement and Mutual Protection of Investments dated 27 November 1998 Country A: Russian Federation Country B: Ukraine",2017-10-14,2016,NA,"State","State","UKR","RUS",NA,0,0,0,0,0,0,2017-10-14
"7","147","Mr. Oleg Vladimirovich Deripaska (Russian Federation) v. the State of Montenegro","Mr. Oleg Vladimirovich Deripaska ","The State of Montenegro ","Pending",2016-12-05,NA,"Investment arbitration","UNCITRAL Arbitration Rules 1976","Manufacturing","Bilateral treaty Agreement between the Government of the Russian Federation and the Federal Government of the Republic of Yugoslavia for the Promotion and Reciprocal Protection of Investments of 11 October 1995 Country A: Russian Federation Country B: - N/A -",2017-10-14,2016,NA,"Other","State",NA,"MNG",NA,0,0,0,0,0,0,2017-10-14
"8","150","Glencore Finance (Bermuda) Limited v. Plurinational State of Bolivia","Glencore Finance  Limited ","Plurinational State of Bolivia ","Pending",2016-07-19,NA,"Investment arbitration","UNCITRAL Arbitration Rules 2010","Mining and quarrying","Bilateral treaty Agreement between the Government of the United Kingdom of Great Britain and Northern Ireland and the Government of the Republic of Bolivia for the Promotion and Protection of Investments, signed on 24 May 1988 and entered into force on 16 February 1990 Country A: United Kingdom Country B: Bolivia",2017-10-14,2016,NA,"Private Entity","State",NA,"BOL",NA,1,1,1,0,0,0,2017-10-14
"9","148","Gold Pool JV Limited v. The Republic of Kazakhstan","Not Available","Not Available",NA,NA,NA,NA,NA,NA,NA,2017-10-14,NA,NA,NA,NA,NA,NA,0,0,0,0,0,0,0,2017-10-14
"10","146","(1) Mr. Josias Van Zyl (South Africa), (2) The Josias Van Zyl Family Trust (South Africa), (3) The Burmilla Trust (South Africa) v. The Kingdom of Lesotho"," Mr. Josias Van Zyl 	                    	                         The Josias Van Zyl Family Trust  	                    	                         The Burmilla Trust  ","The Kingdom of Lesotho ","Pending",NA,NA,"Investment arbitration","UNCITRAL Arbitration Rules 2010","Mining and quarrying","Other This arbitration was commenced in accordance with an award in another investment arbitration.",2017-10-14,NA,NA,"Private Entity","State",NA,"LES",NA,0,0,1,0,0,0,2017-10-14
"11","143","Michael Ballantine and Lisa Ballantine v. Dominican Republic","Michael Ballantine and Lisa Ballantine  ","Dominican Republic ","Pending",2014-09-11,NA,"Investment arbitration","UNCITRAL Arbitration Rules 2013","Real estate","Multilateral treaty Treaty: CAFTA-DR",2017-10-14,2014,NA,"Private Entity","State",NA,"DOM",NA,0,1,1,0,0,0,2017-10-14
"12","142","Resolute Forest Products Inc. v. The Government of Canada","Resolute Forest Products Inc.  ","The Government of Canada ","Pending",2015-12-30,NA,"Investment arbitration","UNCITRAL Arbitration Rules 1976","Manufacturing","Multilateral treaty Treaty: NAFTA",2017-10-14,2015,NA,"Private Entity","State",NA,"CAN",NA,0,1,1,1,1,0,2017-10-14
"13","135","1.Manuel García Armas 2.Pedro García Armas 3.Sebastián García Armas 4.Domingo García Armas 5.Manuel García Piñero 6.Margaret García Piñero 7.Alicia García González 8.Domingo García Cámara 9.Carmen García Cámara c. República Bolivariana de Venezuela","Manuel García Armas 	                    	                        Pedro García Armas 	                    	                        Sebastián García Armas 	                    	                        Domingo García Armas 	                    	                        Manuel García Piñero 	                    	                        Margaret García Piñero 	                    	                        Alicia García González 	                    	                        Domingo García Cámara 	                    	                        Carmen García Cámara ","República Bolivariana de Venezuela ","Pending",NA,NA,"Investment arbitration","UNCITRAL Arbitration Rules 1976",NA,"Bilateral treaty Acuerdo entre la República Bolivariana de Venezuela y el Reino de España para la Promoción y Protección Recíproca de Inversiones, firmado el 2 de noviembre de 1995 y en vigor desde el 10 de septiembre de 1997 Country A: Venezuela Country B: Spain",2017-10-14,NA,NA,"Private Entity","State",NA,"VEN",NA,0,0,0,0,0,0,2017-10-14
"14","144","Indian Metals & Ferro Alloys Limited (India) v. The Government of the Republic of Indonesia","Indian Metals & Ferro Alloys Limited  ","The Government of the Republic of Indonesia ","Pending",2015-07-24,NA,"Investment arbitration","UNCITRAL Arbitration Rules 1976","Mining and quarrying","Bilateral treaty Agreement between the Government of the Republic of Indonesia and the Government of the Republic of India for the Promotion and Protection of Investments dated February 8, 1999 Country A: Indonesia Country B: India",2017-10-14,2015,NA,"Private Entity","State",NA,"INS",NA,0,0,0,0,0,0,2017-10-14
"15","133","Everest Estate LLC et al. v. The Russian Federation","Everest Estate LLC 	                    	                        Edelveis-2000 PE 	                    	                        Fortuna CJSC 	                    	                        Ubk-Invest CJSC 	                    	                        Niva-Tour LLC 	                    	                        IMME LLC 	                    	                        Planeta PE 	                    	                        Krim Development LLC 	                    	                        Aerobud PJSC 	                    	                        Privatoffice  LLC 	                    	                        Dayris LLC 	                    	                        Diline Ltd LLC 	                    	                        Broadcasting Company Zhisa LLC 	                    	                        Privatland LLC 	                    	                        Dan-Panorama LLC 	                    	                        Sanatorium Energetic LLC 	                    	                        AMC Finansovyy Kapital LLC 	                    	                        AMC Financial Vector LLC 	                    	                        Mr. Alexander Valerievich Dubilet ","The Russian Federation  ","Pending",2015-06-19,NA,"Investment arbitration","UNCITRAL Arbitration Rules 1976","Real estate","Bilateral treaty Agreement between the Government of the Russian Federation and the Cabinet of Ministers of Ukraine on the Encouragement and Mutual Protection of Investments dated 27 November 1998 Country A: Russian Federation Country B: Ukraine",2017-10-14,2015,NA,"Private Entity","State",NA,"RUS",NA,0,0,0,0,1,0,2017-10-14
"16","122","(i) Stabil LLC, (ii) Rubenor LLC, (iii) Rustel LLC, (iv) Novel-Estate LLC, (v) PII Kirovograd-Nafta LLC, (vi) Crimea-Petrol LLC, (vii) Pirsan LLC, (viii) Trade-Trust LLC, (ix) Elefteria LLC, (x) VKF Satek LLC,(xi) Stemv Group LLC v. The Russian Federation","Stabil LLC 	                    	                        Rubenor LLC 	                    	                        Rustel LLC 	                    	                        Novel-Estate LLC 	                    	                        PII Kirovograd-Nafta LLC 	                    	                        Crimea-Petrol LLC 	                    	                        Pirsan LLC 	                    	                        Trade-Trust LLC 	                    	                        Elefteria LLC 	                    	                        VKF Satek LLC 	                    	                        Stemv Group LLC ","The Russian Federation ","Pending",2015-06-15,NA,"Investment arbitration","UNCITRAL Arbitration Rules 1976","Oil and gas","Bilateral treaty Agreement between the Government of the Russian Federation and the Cabinet of Ministers of Ukraine on the Encouragement and Mutual Protection of Investments dated 27 November 1998 Country A: Russian Federation Country B: Ukraine",2017-10-14,2015,NA,"Private Entity","State",NA,"RUS",NA,0,0,0,0,1,0,2017-10-14
"17","121","PJSC Ukrnafta v. The Russian Federation","PJSC Ukrnafta ","The Russian Federation ","Pending",2015-06-15,NA,"Investment arbitration","UNCITRAL Arbitration Rules 1976","Oil and gas","Bilateral treaty Agreement between the Government of the Russian Federation and the Cabinet of Ministers of Ukraine on the Encouragement and Mutual Protection of Investments dated 27 November 1998 Country A: Russian Federation Country B: Ukraine",2017-10-14,2015,NA,"Private Entity","State",NA,"RUS",NA,0,0,0,0,1,0,2017-10-14
"18","126","Stans Energy Corp. and Kutisay Mining LLC v. ­The Kyrgyz Republic","Stans Energy Corp. and Kutisay Mining LLC ","The Kyrgyz Republic ","Pending",2015-05-13,NA,"Investment arbitration","UNCITRAL Arbitration Rules 1976","Mining and quarrying","Other Law of the Kyrgyz Republic on Investments in the Kyrgyz Republic, adopted on 27 March 2003",2017-10-14,2015,NA,"Private Entity","State",NA,"KYR",NA,0,0,0,0,0,0,2017-10-14
"19","124","(1) Limited Liability Company Lugzor, (2) Limited Liability Company Libset, (3) Limited Liability Company Ukrinterinvest, (4) Public Joint Stock Company DniproAzot, (5) Limited Liability Company Aberon Ltd v. The Russian Federation","Limited Liability Company Lugzor 	                    	                        Limited Liability Company Libset 	                    	                        Limited Liability Company Ukrinterinvest 	                    	                        Public Joint Stock Company DniproAzot 	                    	                        Limited Liability Company Aberon Ltd ","The Russian Federation ","Pending",2015-05-26,NA,"Investment arbitration","UNCITRAL Arbitration Rules 1976","Real estate","Bilateral treaty Agreement between the Government of the Russian Federation and the Cabinet of Ministers of Ukraine on the Encouragement and Mutual Protection of Investments, dated 27 November 1998 Country A: Russian Federation Country B: Ukraine",2017-10-14,2015,NA,"Private Entity","State",NA,"RUS",NA,0,0,0,0,0,0,2017-10-14
"20","130","PJSC CB PrivatBank and Finance Company Finilon LLC v. The Russian Federation","PJSC CB PrivatBank 	                    	                        Finance Company Finilon LLC ","The Russian Federation ","Pending",2015-04-13,NA,"Investment arbitration","UNCITRAL Arbitration Rules 1976","International investment law","Bilateral treaty Agreement between the Government of the Russian Federation and the Cabinet of Ministers of Ukraine on the Encouragement and Mutual Protection of Investments dated 27 November 1998 Country A: Russian Federation Country B: Ukraine",2017-10-14,2015,NA,"Private Entity","State",NA,"RUS",NA,0,0,0,0,1,0,2017-10-14
"21","123","Aeroport Belbek LLC and Mr. Igor Valerievich Kolomoisky v. The Russian Federation","Aeroport Belbek LLC 	                    	                        Mr. Igor Valerievich Kolomoisky ","The Russian Federation ","Pending",2015-01-13,NA,"Investment arbitration","UNCITRAL Arbitration Rules 1976","International investment law",NA,2017-10-14,2015,NA,"Private Entity","State",NA,"RUS",NA,0,0,0,0,1,0,2017-10-14
"22","119","WNC Factoring Limited (United Kingdom) v. The Czech Republic","WNC Factoring Limited ","The Czech Republic ","Pending",2014-09-26,NA,"Investment arbitration","UNCITRAL Arbitration Rules 1976",NA,NA,2017-10-14,2014,NA,"Private Entity","State",NA,"CZR",NA,0,0,0,0,0,0,2017-10-14
"23","114","Mytilineos Holdings S.A. (Greece) v. The Republic of Serbia","Mytilineos Holdings S.A.  ","The Republic of Serbia ","Pending",NA,NA,"Investment arbitration","UNCITRAL Arbitration Rules 2010",NA,"Bilateral treaty Agreement between the Government of the Hellenic Republic and the Government of the Federal Republic of Yugoslavia on the Reciprocal Promotion and Protection of Investments dated 25 June 1997 Country A: Greece Country B: Serbia",2017-10-14,NA,NA,"Private Entity","State",NA,"SRB",NA,0,0,0,0,0,0,2017-10-14
"24","113","Louis Dreyfus Armateurs SAS (France) v. The Republic of India","Louis Dreyfus Armateurs SAS ","The Republic of India  ","Pending",2014-03-31,NA,"Investment arbitration","UNCITRAL Arbitration Rules 1976",NA,"Bilateral treaty Agreement between the Government of the Republic of India and the Government of the Republic of France on the Reciprocal Promotion and Protection of Investments dated 2 September 1997 Country A: India Country B: France",2017-10-14,2014,NA,"Private Entity","State",NA,"IND",NA,0,0,0,0,0,0,2017-10-14
"25","24","Antaris Solar GmbH (Germany) and Dr. Michael Göde (Germany) v. The Czech Republic","Antaris Solar GmbH  	                    	                        Dr. Michael Göde ","The Czech Republic ","Pending",NA,NA,"Investment arbitration","UNCITRAL Arbitration Rules 1976","- Other -","Bilateral treaty Agreement between the Federal Republic of Germany and the Czech and Slovak Federal Republic on the Promotion and Reciprocal Protection of Investments Country A: Germany Country B: Czech Republic Multilateral treaty Treaty: Energy Charter Treaty (ECT)",2017-10-14,NA,NA,"Private Entity","State",NA,"CZR",NA,0,0,0,0,0,0,2017-10-14
"26","136","Venezuela US, S.R.L. (Barbados) v. The Bolivarian Republic of Venezuela","Venezuela US, S.R.L.  ","The Bolivarian Republic of Venezuela ","Pending",2013-03-22,NA,"Investment arbitration","UNCITRAL Arbitration Rules 1976","Oil and gas","Bilateral treaty Agreement between the Government of Barbados and the Republic of Venezuela for the Promotion and Protection of Investments Country A: Barbados Country B: Venezuela",2017-10-14,2013,NA,"Private Entity","State",NA,"VEN",NA,0,0,0,0,0,0,2017-10-14
"27","6","(1) Tenoch Holdings Limited (Cyprus) (2) Mr. Maxim Naumchenko (Russian Federation) (3) Mr. Andrey Poluektov (Russian Federation) v. The Republic of India","Mr. Maxim Naumchenko  	                    	                        Tenoch Holdings Limited  	                    	                        Mr. Andrey Poluektov  ","The Republic of India ","Pending",NA,NA,"Investment arbitration","UNCITRAL Arbitration Rules 1976",NA,"Bilateral treaty Agreement between the Government of the Republic of Cyprus and the Government of the Republic of India for the Mutual Promotion and Protection of Investments dated 9 April 2002 Country A: Cyprus Country B: India Bilateral treaty Agreement between the Government of the Russian Federation and the Government of the Republic of India for the Promotion and Mutual Protection of Investments dated 23 December 1994 Country A: Russian Federation Country B: India",2017-10-14,NA,NA,"Private Entity","State",NA,"IND",NA,0,0,0,0,0,0,2017-10-14
"28","54","South American Silver Limited (Bermuda) v. The Plurinational State of Bolivia","South American Silver Limited ","The Plurinational State of Bolivia","Pending",2013-04-30,NA,"Investment arbitration","UNCITRAL Arbitration Rules 2010","Mining and quarrying","Bilateral treaty Agreement between the Government of the United Kingdom of Great Britain and Northern Ireland and the Government of the Republic of Bolivia for the Promotion and Protection of Investments Country A: United Kingdom Country B: Bolivia",2017-10-14,2013,NA,NA,"State",NA,"BOL",NA,1,1,1,0,0,0,2017-10-14
"29","46","CC/Devas (Mauritius) Ltd., Devas Employees Mauritius Private Limited, and Telcom Devas Mauritius Limited v. Republic of India","CC/Devas  Ltd. 	                    	                        Devas Employees Mauritius Private Limited 	                    	                        Telcom Devas Mauritius Limited ","Republic of India ","Pending",NA,NA,"Investment arbitration","- Other -","Telecommunications","Bilateral treaty Agreement between the Government of the Republic of Mauritius and the Government of the Republic of India for the Promotion and Protection of Investments Country A: Mauritius Country B: India",2017-10-14,NA,NA,"Private Entity","State",NA,"IND",NA,0,0,0,0,0,0,2017-10-14
"30","8","Merck Sharpe & Dohme (I.A.) LLC v. The Republic of Ecuador","Merck Sharpe & Dohme  LLC ","The Republic of Ecuador ","Pending",NA,NA,"Investment arbitration","UNCITRAL Arbitration Rules 1976","Pharmaceutical","Bilateral treaty Treaty between the United States of America and the Republic of Ecuador Concerning the Encouragement and Reciprocal Protection of Investment Country A: United States Country B: Ecuador",2017-10-14,NA,NA,"Private Entity","State",NA,"ECU",NA,0,0,0,0,0,0,2017-10-14
"31","49","1. Chevron Corporation and 2. Texaco Petroleum Company v. The Republic of Ecuador","Chevron Corporation 	                    	                        Texaco Petroleum Company ","The Republic of Ecuador ","Pending",NA,NA,"Investment arbitration","UNCITRAL Arbitration Rules 1976",NA,"Bilateral treaty Treaty between the United States of America and the Republic of Ecuador concerning the Encouragement and Reciprocal Protection of Investment Country A: United States Country B: Ecuador",2017-10-14,NA,NA,"Private Entity","State",NA,"ECU",NA,0,0,0,0,0,0,2017-10-14
"32","50","Bilcon of Delaware et al v. Government of Canada","William Ralph Clayton 	                    	                        William Richard Clayton 	                    	                        Douglas Clayton 	                    	                        Daniel Clayton 	                    	                        Bilcon of Delaware INC. ","Government of Canada ","Pending",NA,NA,"Investment arbitration","- Other -",NA,"Multilateral treaty Treaty: NAFTA",2017-10-14,NA,NA,"Private Entity","State",NA,"CAN",NA,1,1,1,1,1,0,2017-10-14
"33","137","D. v. Energy Community","D. ","Energy Community ","Pending",2016-03-04,NA,"Contract-based or other arbitration","Permanent Court of Arbitration Optional Rules for Arbitration between International Organizations and Private Parties","- Other -","Contract Employment Agreement between the Parties, dated July 18, 2007. Other Staff Regulations of the Energy Community, as amended, December 18, 2009. Other Agreement between the Republic of Austria and the Energy Community regarding the Seat of the Secretariat of the Energy Community, dated May 29, 2007.",2017-10-14,2016,NA,"Other","IO",NA,NA,NA,0,0,0,0,0,0,2017-10-14
"34","128","Maynilad Water Services, Inc. (Philippines) v. Republic of the Philippines","Maynilad Water Services, Inc.  ","Republic of the Philippines ","Pending",2015-03-27,NA,"Contract-based or other arbitration","UNCITRAL Arbitration Rules 1976",NA,NA,2017-10-14,2015,NA,"Private Entity","State",NA,"PHI",NA,0,0,0,0,0,0,2017-10-14
"35","111","1. EcuadorTLC S.A. (Ecuador) 2. Cayman International Exploration Company S.A. (Panamá) 3. Teikoku Oil Ecuador (Islas Caimán) c. 1. República del Ecuador 2. Secretaría de Hidrocarburos del Ecuador 3. Empresa Pública de Hidrocarburos del Ecuador EP Petroecu","Ecuador TLC S.A.  	                    	                        Cayman International Exploration Company S.A.  	                    	                        Teikoku Oil Ecuador  ","República del Ecuador 	                    	                        Secretaría de Hidrocarburos del Ecuador 	                    	                        Empresa Pública de Hidrocarburos del Ecuador EP Petroecuador ","Pending",NA,NA,"Contract-based or other arbitration","UNCITRAL Arbitration Rules 1976",NA,"Contract Contrato de Participación para la Exploración de Hidrocarburos y Explotación de Petróleo Crudo en el Bloque Número 18 del Mapa Catastral Petrolero Ecuatoriano de 19 de diciembre de 1995, modificado por el Contrato Modificatorio de 31 de octubrede 2008, y el Convenio Operacional de Explotación Unificada del Yacimiento Común Hollín en elCampo Palo Azul de 7 de agosto de 2002, modificado por el Convenio Modificatorio de 31 de octubre de 2008.",2017-10-14,NA,NA,NA,NA,"ECU",NA,NA,0,0,0,0,0,0,2017-10-14
"36","138","Mr. Mohamed Ismail Reygal (Somalia) v. The United Nations High Commissioner for Refugees (UNHCR)","Mr. Mohamed Ismail Reygal  ","The United Nations High Commissioner for Refugees  ","Concluded",2015-10-16,2017-03-27,"Contract-based or other arbitration","UNCITRAL Arbitration Rules 2010","Administrative and support service","Contract Contract for Interpreters concluded between the Parties on April 7, 2015",2017-10-14,2015,2017,"Private Entity","IO",NA,NA,0,0,0,0,0,0,0,2017-10-14
"37","134","Consorcio Sogeosa-Tilmon (Costa Rica) c. El Instituto Tecnológico de Costa Rica (Costa Rica)","Consorcio Sogeosa-Tilmon  ","El Instituto Tecnológico de Costa Rica  ","Concluded",2016-03-11,2016-07-26,"Other proceedings","- Other -",NA,"Contract Contrato No EDU-ITCR-210-LPI-O-2013LPI-0001-APITCRBM-001-CO-2014, adjudicado bajo la licitación pública No. 2013LPI-0001-APITCRBM",2017-10-14,2016,2016,"Private Entity","State",NA,"COS",0,0,0,0,0,0,0,2017-10-14
"38","141","Arbitration under the Timor Sea Treaty (Timor-Leste v. Australia)","Timor-Leste ","Australia ","Concluded",2015-09-15,NA,"Inter-state arbitration","- Other -",NA,"Bilateral treaty Timor Sea Treaty Country A: Timor-Leste Country B: Australia",2017-10-14,2015,NA,"State","State","ETM","AUL",0,0,0,1,0,0,0,2017-10-14
"39","116","Indian Potash Limited (India) v. Agriculture Inputs Company Limited (Nepal)","Indian Potash Limited   ","Agriculture Inputs Company Limited  ","Concluded",NA,2016-12-02,"Contract-based or other arbitration","UNCITRAL Arbitration Rules 2010","Agriculture, forestry and fishing","Contract Contract for Supply and Delivery of 30,000MT Urea 46% N Chemical Fertilizers under Tender Notice No. KPM/29/067/68 Contract No. 13/068/69, entered into between the Parties on August 8, 2011",2017-10-14,NA,2016,"State","Private Entity","IND",NA,1,0,0,0,0,0,0,2017-10-14
"40","118","Mr. Kristian Almås and Mr. Geir Almås v. The Republic of Poland","Mr. Kristian Almås  	                    	                         Mr. Geir Almås  ","The Republic of Poland ","Concluded",2013-11-01,2016-06-27,"Investment arbitration","UNCITRAL Arbitration Rules 1976","Agriculture, forestry and fishing","Bilateral treaty Agreement between the Government of the Kingdom of Norway and the Government of the Republic of Poland on the Promotion and Reciprocal Protection of Investments dated 5 June 1990 Country A: Norway Country B: Poland",2017-10-14,2013,2016,"Private Entity","State",NA,"POL",1,0,0,0,0,0,0,2017-10-14
"41","115","1. Iberdrola, S.A. (España) 2. Iberdrola Energía, S.A.U. (España) c. El Estado Plurinacional de Bolivia","Iberdrola, S.A.    	                    	                        Iberdrola Energía, S.A.U.   ","Estado Plurinacional de Bolivia  ","Concluded",2014-07-29,NA,"Investment arbitration","UNCITRAL Arbitration Rules 1976","Electricity/Power","Bilateral treaty Acuerdo para la Promoción y la Protección Recíproca de Inversiones entre el Reino de España y la República de Bolivia, hecho en Madrid el 29 de octubre de 2001 Country A: Spain Country B: Bolivia",2017-10-14,2014,NA,"Private Entity","State",NA,"BOL",1,1,0,0,0,0,0,2017-10-14
"42","139","Financial Performance Holdings B.V. (the Netherlands)  v. The Russian Federation","Financial Performance Holdings B.V. ","The Russian Federation ","Concluded",2014-03-25,2016-09-27,"Investment arbitration","UNCITRAL Arbitration Rules 1976",NA,"Multilateral treaty Treaty: Energy Charter Treaty (ECT)",2017-10-14,2014,2016,"Private Entity","State",NA,"RUS",0,0,0,0,0,0,0,2017-10-14
